{
  "policy_id": "policy.fraud.supermajority",
  "mode": "macp.mode.decision.v1",
  "schema_version": 3,
  "description": "Fraud review: two-thirds supermajority with 2-voter quorum, no veto",
  "rules": {
    "voting": {
      "algorithm": "supermajority",
      "threshold": 0.67,
      "quorum": { "type": "count", "value": 2 }
    },
    "objection_handling": {
      "critical_severity_vetoes": false,
      "veto_threshold": 0
    },
    "evaluation": {
      "minimum_confidence": 0.0,
      "required_before_voting": false
    },
    "commitment": {
      "authority": "initiator_only",
      "require_vote_quorum": true,
      "designated_roles": []
    }
  }
}
