{
  "policy_id": "policy.lending.conservative",
  "mode": "macp.mode.decision.v1",
  "schema_version": 3,
  "description": "Lending: supermajority with compliance veto and mandatory evaluations before voting",
  "rules": {
    "voting": {
      "algorithm": "supermajority",
      "threshold": 0.67,
      "quorum": { "type": "count", "value": 3 }
    },
    "objection_handling": {
      "critical_severity_vetoes": true,
      "veto_threshold": 1
    },
    "evaluation": {
      "minimum_confidence": 0.6,
      "required_before_voting": true
    },
    "commitment": {
      "authority": "designated_role",
      "require_vote_quorum": true,
      "designated_roles": ["risk-agent", "compliance-agent"]
    }
  }
}
